{
  "scenario_id": "ls_help",
  "rationale": "Capture basic usage and flags from ls --help.",
  "binary": {
    "path": "/path/to/ls"
  },
  "args": ["--help"],
  "fixture": {
    "id": "fs/empty_dir"
  },
  "limits": {
    "wall_time_ms": 200,
    "cpu_time_ms": 100,
    "memory_kb": 65536,
    "file_size_kb": 1024
  },
  "artifacts": {
    "capture_stdout": true,
    "capture_stderr": true,
    "capture_exit_code": true
  }
}
